Date,Year,Pros,Cons
2018-05-01,2018,"Generally good with several very frustrating features”
 Can store all of our contacts in the same place as opportunities.
 Sales funnel and sales tools combined with the potential for invoices/shipping/etc also included. Differentiation between contacts and customers helps streamline project work.
","No way of automatically updating contact details on contacts by changing details on customers, editing contacts/customers becomes quite laborious. Cant delete suppliers."
2018-04-24,2018,"Excellent tool to generate projects as well as the sales process”
 This tool is very useful to evaluate and organize the entire sales process that a company has with its products or services, it also has application for the phone and works very well
","It is a bit expensive as most applications but you can pay, since its use value is at a good price, its interface may improve over time
"
2018-04-24,2018,"Great product but prefer other services. ”
 
 The high hopes that we had were met but ended up going with another product. We liked the concept provided, the workflow, and the price point. You will definitely be happy with this product if you choose it.
","Use was easy but could have had more. I can see this being costly for some companies depending on their expenditures. Also, an updated interface would be nice.
"
2018-04-04,2018,"A different option”
 I can keep many different items together such as inventory building materials projects products etc etc in one place and although I can access it on the go it is limited to what I can actually get to from the app.
 I love that there are multiple options that you can set to your requirements you can set up any number of items that are connected such as projects CRM expenses inventory and a host of other things and makes it really flexible and customizable.
","It is a bit too difficult to navigate and takes a little bit of learning to get used to it I'm still getting acquainted with the program and have had difficulty syncing the calendar and tasks which is a bit of a bummer because those are things that I really did need to have available to me however that's minor.
"
2018-04-04,2018,"Integrate help in your apps
 It is really nice how effortlessly you can integrate a helpdesk in your apps. It supports both iOS and Android and looks pretty good in both versions. The paid version brings a few nice reports and integrations, which the free version misses.
","It can be a bit pricey for small companies. Besides, some of the integrations don't' work perfectly, there can be issues with emails and reports. Other than that it is a really nice way to provide customer support right from your app.
"
2018-03-27,2018,"Superb”
 Saving my time on invoicing.
 Free version provides a lot of functionality and the paid is very reasonable. Single product to manage all your CRM, Leads, Project Management, Time Billing, Invoicing, HelpDesk and more. Great support too and proactive bug fixes.
",It would be great the user interface can be made modern as it is bit cluttered. I can't fault anything else.
2018-03-04,2018,"Apptivo - Get what you pay for”
 Apptivo is a good price without signing annual membership. It is also fairly easy, ONCE it is set up. Apptivo offers a nice clean Mobile app, again, ONCE it is set up.
","Continuous email syncing issues - even with common G-Mail applications. Email app very difficult to use. Primary use - good for organizing once synced. App offers many features - but they do not flow from one app to another. For example, set up tags on the customer page, but tags are lost when building an opportunity for that same customer. If you want the tags, you need to re-enter on the opportunity page.
"
2018-02-13,2018,"The price compared to competitors is very affordable. The software is very customizable. Service team was quick to respond to issues.
","Not fully baked CRM,. Seems like many features weren't totally integrated or well fleshed out. We had many issues importing our existing contacts over.
"
2018-02-09,2018,"Customizable solution, solid”
 We started using the free version and we loved the way to work with this tool, the paid versions bring many features that make it very competitive compared to other market options. I recommend it for medium or small companies that are starting and do not want to invest in a very expensive CRM.
 In Apptivo almost everything can be customized. It has triggers that let users build custom workflow automation rules for any app, base rules on specific events, or look at events over time.
","I would like to have better analytical reports, campaign segmentation, delivery tracking, spam check, however, these features do not prevent enjoy this tool.
"
2018-01-11,2018,"Very useful and well integrated software”
 I really like the fact that it integrates with the HR and CRM modules.
 This software has many great features. I really like how the software integrates with other components like the HR and CRM modules. I like that this software includes the Gantt View for scheduling.
","I would like to see the WBS available in this software. The WBS feature would also be nice if it was a graphic /mindmap view instead of a list view. It would really assist in planning.
"
2017-12-28,2017,"Prasanna was great to work with..”
 Easy to use... has many features to use... This program does more then you think.. Online support has always been great.
","Software runs a little slow.. Still learning about the program to know what I like and don't. Hope to learn more..
"
2017-12-23,2017,"Great for sub/contractors”
 Keeping track of contractors work and increasing accountability.
 I like the ability to the client date is all in one place which makes researching transactions and such a breeze , also that the software is equipped with invoicing abilities which makes record keeping easy as well.
","one of the things that I personally did not like was the amount of time that it takes to adequately set up this software, it takes in my opinion too much time to set up and that can be a bit of a turn off.
"
2017-12-14,2017,"Works Just Fine”
 Happy enough with this product for the price it does what we need it to do.
 Works well for our purposes. I know for sure we do not use the system to its fullest potential but the business is fairly new and we have reworked our process several times. It has still been very helpful despite our under utilization. It is something I plan to correct. Great customer support though and a good amount of customization options
","A lot of work to set up correctly and get it to do what you need it to. Does not directly incorporate facebook leads (our businesses primary source of new leads currently)
"
2017-12-12,2017,"Great way for multiple people on a team to manage and use contacts”
 This software is key to organizing and maintaining addresses!
 Apptivo is a program that our ministry uses to keep our subscriber addresses organized and updated. We have several people on our team going in to make changes on a consistent basis, and this program helps track who has changed what and when. Also, we have multiple lists with thousands of addresses, and it can handle the large volume.
","The only con I would state is that we use abbreviated states in order to send mail cass certified. Apptivo uses the full name of states, so we have to use formulas when we export to Excel in order to print labels correctly. It can be a hassle.
"
2017-12-28,2017,"A solid solution for managing clients and incoming cases for a quickly growing business. ”
 Managing our customer service and response time.
 Apptivo was relatively quick and easy to install, especially compared to larger CRM platforms. It was easy to train out team and quickly take control of customer service and response time by turning every email into a case. Having an easy way to search cases/customers and have a history of all our interactions with them has made a great improvement on our business this past year, particularly during our busy season.
","There needs to be a way to file archived emails and we wish the email app and CRM cases app were interlinked.
"
2017-11-17,2017,"Apptivo wow!”
 what I really like about this program is the customer service that is provided. it is one of the best i have come across and they are extremely helpful
","tracking connections and does not import a lot of the useful data to and from quickbooks like i would want.
"
2017-11-16,2017,"Excellent”
 Helps me rotate my clients and clean my other CRM system. Is nice to use new systems and learn new products.
","It rotates clients. Customer Service is very good attentive. It works well with my existing crm. I will continue and pay.
"
2017-11-09,2017,"Good entry CRM app”
 Report package is just what we need and not over-complicated. Ability to have a single repository for sales and order history.
 The learning curve isn't as steep as some other apps, which makes it a great CRM introductory product to enhance your sales efforts. This helps when you have different work styles you are trying to get on the same page. Reports are clean and concise, which is absolutely necessary for understanding sales stages and forecasting.
","When customizing, you can be limited to quantity of fields you can add. Surprisingly, it does not have standard a field for product.
"
2017-10-30,2017,"Great out of the box”
 I like the tech support the best. They are fantastic makes the product a great fit for us. The tracking is a little weak but a steal for the money.
","Missing some of the tracking connections and does not import a lot of the useful data to and from quickbooks.
"
2017-10-19,2017,"The starter software for a CRM”
 If you are a good self learner this could be a great SW to start a CRM with and then you can add modules as you go along. Great value .
 The software is easy to change once you use and understand the relationships between the modules. You have the ability to change the names of fields throughout the software . Very flexible.
","The documentation is not readily available and the fields are not clearly explained. It seem as if they just wrote the software and did not document it well.
"
2017-10-02,2017,"Best IT people I worked with”
 I think after we get all the kinks out, it will be just fine.
 The support staff is the best. From now on I will only ask for them. Fixed all my problems that took one day, others tried for two weeks and I never did get a response on anything I needed help with.
","Other IT support agents would not be able to help me. They never let me know if they tried to fix anything.
"
2017-09-23,2017,"Good Support”
 Live Chat is a really good feature.
 The product has many features and the 24/7 Support is great, really helpful when trying to set everything up.
","It's not easy to find every feature and there is lots of things needed to get any feature to work. Sometimes the Live Chat can disconnect you as well if you refresh the page and you have to start all over again.
"
2017-09-06,2017,"So far, I like this software”
 I am still in the testing phase of this software. Currently testing one other. So far, It looks like Apptivo will win. The best part is the live help via the chat window 24/7. They ALWAYS solve my problem right away. Only once they couldn't but it was due to a glitch which they immediately turned over to the tech guys to fix. Outstanding support goes a long way.
 Seems to have all of the tools that I need and the simplicity of this software gives me more time to focus on my clients projects instead of spending hours on the CRM like some of the other CRM packages.
","The interface is nice, but could be better. However, this is more of a personal preference. I like things to take up the least amount of screen space as possible. Although the software is highly customizable, yo cannot reduce the field sizes. They appear large and clunky in some windows.
"
2017-08-16,2017,"I am a beginner with Apptivo CRM and I needed advice and help with setting up.”
: The good organization of the management of my eMails and the relations with the customers, on the other hand, the ease of searching eMails.
 The service quality of the Apptivo team was excellent. I was accompanied until the complete resolution of the parameterization problems. The quality of the relationship was excellent. The CRM software is one of the best suited to customer relationship management needs. It is, complete, simple and accessible. I am very satisfied.
","The assignment of eMails to contacts and customers, as well as the management of leads. It's very simple and it's very flexible. On the other hand, it works well in impa with Google Apps.
"
2017-07-27,2017,"Concept of having all parts of the system connect is nice, but unfortunately it creates more headaches than it's worth.
","Nice concept, really buggy. It's super glitchy. There are more bugs in this system than I ever seen. I also don't think the engineers who built this have ever worked with an actual business. There were simple things that would never fly in a serious business. For example, the reports it generates are discounted by a factor of probability of closing a sale, and cannot be adjusted. So reports don't reflect actual values of the sales pipeline. Over 1 year, I spent way too much time reporting issues hat were often met with ""thank you for your recommendation, we will submit a request to engineering for this improvement"". Super frustrating. In other cases, there were apps that were not even accessible to my employees, for reasons that couldn't be explained to me. 4 months later, they still can't access.
"
2017-07-20,2017,"Apptivo for small business”
 Highly recommend.
 The functionality for the price is fantastic for a small business. Choose from 50 apps in the CRM package and no matter how many of the apps you use, the price is the same. Integrates with many other apps including RingCentral. Tech support is very responsive 24/7 via Chat and email.
","Somewhat complex to set-up the first time, however, the program is very flexible. Because of the flexibility, the complexity is increased.
"
2017-07-17,2017,"Thinking about apptivo?”
 Great CRM, with excellent customer service. def worth a try.
 Great system to get you started and beyond. The ""if you dont know just ask"" concept is great. i use it all the time
","a little to easy at times. there should be more control for advanced users. Even though most folks wont need it..the ability should be there
"
2017-07-12,2017,"Excellent CRM- fits all our needs better than others I researched, extremely user-friendly and best staff”
 So far I absolutely love how user-friendly the whole system has been, can easily access any type of customer service, and everyone is quick to help, knowledgeable, and all questions answered immediately.
",-
2017-07-12,2017,"Thought it was a joke”
 Can the apptivo team bring more in the future ? We hope so.
 Never ever met a software for business management with everything onboard and much ease of use. My team is is blowing up with joy and exploding with productivity. Business will never be the same again. We just got customizing everything to suite our specific needs. We are glad to be here.
",-
2017-07-03,2017,"On line Chat help
 Great help from Maria in the support team, answered all my questions, including the daft ones. Well done.
","Clear and to the point support, which is very reassuring. It is good to know you have someone available to talk you through functions, especially when you are finding your way.
"
2017-06-29,2017,"Apptivo Review”
 Overall it is an excellent product for the price.
 Lot of features Easy to customize Adding tags feature is great Grouping records is one of the best features Great support Mobile app is great
","Sometimes slow The system has bugs Some modules are not good enough . For example , campaign module is not robust and do not have all features needed No application colors to make the program more readable
"
2017-06-22,2017,"Answered my questions every time. ”
 Great CRM!
 Quick and efficient with almost every issue I had. There really is so much that this software can do that sometimes it gets daunting but, their staff is there to help you. THANK YOU MARIA!
",Almost too many options. It felt like getting lost in the forest looking for a tree. The FAQ is very informative if you need quick reference.
2017-06-09,2017,"Apptivo support is always available and ready to help with issues ”
 Apptivo support is very good in assisting and the app has cool functionalities for project management in one project app .
 good Apptivo support, help provided through screen sharing, demo offer for new clients, updates features if put in request
","some features can still be improved but works well to manage projects from one application, and to work as crossfunctional teams.
"
2017-06-08,2017,"Customer support is fantastic 24/7”
 Very intuitive, clean design. That is easy to customize. Very flexible and has app's as you need more.
","The instructions are written for an IT person and someone that already knows what the issue is. If the instruction were just re worded a bit. It would be easier for a newbie
"
2017-06-07,2017,"Easy to set up, we began using it right away!”
 Ability to manage and track cases and projects. Ability to easily track and see employees projects and cases.
 Ease of use. We needed something to track and manage cases and we didn't have time for a lengthy set up. With Apptivo's design and ease of use we were able to get it going right away and then integrate and add more features gradually as we went along. I also really like how you can customize each app to fit your businesses needs. We have a very niche business and being able to track the details of each of orders and customers has been very helpful.
","The email app needs further development. I'd like to be able to archive my emails into different folders.
"
2017-05-16,2017,"Excellent Service”
 Brilliant CRM system especially for growing businesses.
 The system has everything you need and the support service is fantastic. Throughout each stage, the online support agents have helped to make life so much easier.
",-
2017-05-10,2017,"On day 2 of my 30 day trial and customer service has been fantastic and immediate. ”
 The UI/UX very intuitive and FAQs are very detailed. Customer Service has been extremely helpful in my immediate questions and have no doubt that will continue. Product is also very customizable as we only wanted the CRM functionality not leads/opportunities.
","Haven't noticed any issues yet except a slight cacheing issue with some of the fields in palette. Other thing is lack of customizable reports.
"
2017-05-09,2017,"The service is really good! ”
 Price and service
 Customer Support is very good, fast, responsive and works well, larger problems they remotely access your computer and solve problems quickly.
","Features & Functionality - The system is new and still lacking many features, such as sales order has no way to configure, the apps for Ipad is still poor and other points.
"
2017-05-01,2017,"Amazing value, Flexible and full of useful features.. They love their clients”
 I spent a combined couple of weeks researching for CRM with good features, mailing lists and flexibility for custom fields and tags. Most were $ per user per month for BASIC package. This is hands down the best value for the money with all the functionality they offer. Customer service are quick to respond and extremely helpful. I love this product and the way the company treats its clients!
 Great price, feature rich, customer service is prompt to assist and go out of their way to make sure client is satisfied.
","Would be nice to have better documentation with table of contents and explanation for every feature.. The ""Answers"" section seems to 'Sort of' do the job
"
2017-04-30,2017,"The interface, functionality and configurability of Apptivo CRM is superb. ”
 Quick setup, compartmentalized functionality so we can add features as we go along, and of course the ability to track our contacts, customers, and sales. This makes it not just a CRM system, but also an invoice and accounting system and reporting tool. At its price point, its features and full support, it is hard to beat.
 The heuristics of the interface provides the user with an natural environment to learn and work within. It's configurability is superb and it's modular functionality provides the right amount of compartmentalization that allows the user to focus on just the features the need. This enhances navigation and the user's learning curve. On top of all this, Apptivo provides top notch support, even through the trial phases of their product. Their support representatives are online 24/7, and in one instance, Mani provided me an upgrade and customization for my particular application. With such competent and helpful free product support, I have total confidence in our companies ability to roll out a great implementation of CRM. All of the features we desire are available on a mobile platform, so we really couldn't ask for much more.
","A few minor quibbles, none functionally inhibiting. In creating views the product automatically alphabetized them and I would have preferred to display them in a custom order. Between Apps, which are really views, their is not a 2-way synchronization of fields, only a one-way push is offered. The product keeps a history of all changes, so we have yet to notice weeknesses in how user accounts are handled.
"
2017-04-28,2017,"Outstanding Customer Services!!! Also, especially considering the price point”
 We use Apptivo for CRM for our contact management. It's easy to use, and the recent update is wonderful. I really appreciate the ability to customize everything I want and need, from the fields and look at the workflow for each contact.
","Nothing so far. I have had great interaction with support team. I was satisfied.
"
2017-04-26,2017,"Excellent Customer Support ”
 I had a really annoying issue that had me frustrated all morning about importing a product list. The advisor gave me a method that nearly fixed my issue completely and on second attempt they took over fixed the issue in minutes and explained to me what to do next time. Very high level of customer service.
 Easy to setup, easy to use and amazing customer support. Recommendation: No real marketing features but if you have been banging your head against the wall trying to find a CRM that lets you keep everything in one place then this is your best bet

","Not a comprehensive solution for what we were looking for in terms of having marketing features but has absolutely everything else we could need in a great user interface thats easy to understand
"
2017-04-24,2017,"I,am receiving a prompt and quality support to customize according to my needs. Very easy to customize apps.

",-
2017-04-22,2017,"Multiple Business Functionality
Overall: With the assistance of Mani on the help desk, I was able to successfully integrate my two businesses into the app. Overall the Apptivo meets all of my needs as well as that of my employees and consultants.
",-
2017-04-19,2017,"This is what Businesses NEED”
 Customized Apps is perfect for a business of all types. Not only am I currently learning everything this product can do I will be personally telling other business owners how great this is! We are in the set up process and already using it - this is GREATNESS!
",-
2017-04-18,2017,"""Great first experience!”
 I've only recently been introduced to Apptivo. Ran into some questions while using the CRM and Karthi the online customer support was very helpful, quick and polite.
 Easy to use and comprehensive at affordable price""","Sometimes it's not very touchscreen friendly; this could be a combination of hardware and software issue.
"
2017-03-11,2017,"“Powerfull apps for all type of business”
 all the apps need for businesses in one place , easy to use . Very good support from the apps ypu cna reach
 All app needed for a businesses from small to large size
",-
2017-03-10,2017,"Excellent CRM software”
 Provide RTL support and multilingual portal.
 Easy to use, rich in out-of-the-box features, provide good layout designer, and wide set of API's to extend the platform.
","None that matters to my organization at the moment. However, Arabic (or RTL) support is very limited and for customers whom their business communications and interactions are completely (or mostly) based on Arabic languages this product will not fit.
"
2017-03-09,2017,"Great support”
 So far it does everything we want and the support has been very helpful. The support staff was great!
",-
2017-03-07,2017,"Early-stage configuration and use; going well”
 Our early efforts to configure Apptivo for our organization are going well. Have offered four stars for Ease/Features only for the time being, since we are still on the learning curve. Have been generally very pleased so far.
",-
2017-03-06,2017,"Great customer support ”
 Customer/technical service representative was very helpful. Staff was able to help with to bulk delete incorrect data for us.
",-
2017-02-22,2017,"Customer Service is Outstanding”
 The representative from Apttivo was very patient and helpful. It has only been 2 weeks since I started working with them, but so far, I am very satisfied. I would recommend Apptivo to other small businesses.
",-
2017-02-16,2017,"Overall: So far our experience has been great, and we are just learning how to use the product. Customer support has been fast and competent.
 Price & functionality
",-
2017-02-13,2017,"Adding new user”
 The new user was unable to groups, help desk worked with me until we resolved this
",-
